{
  "@context": [
    "http://www.w3.org/ns/anno.jsonld",
    {
      "ocam": "https://ocam.sport/ns#",
      "domain": "ocam:domain",
      "sport": "ocam:sport",
      "sequence": "ocam:sequence",
      "step": "ocam:step"
    }
  ],
  "id": "urn:uuid:e5f6a7b8-c9d0-1234-ef01-567890123456",
  "type": "Annotation",
  "motivation": "describing",
  "created": "2024-03-19T09:00:00Z",
  "creator": {
    "id": "https://example.org/coach/james-wilson",
    "type": "Person",
    "name": "James Wilson"
  },
  "sport": "american-football",
  "domain": "technique",
  "sequence": {
    "title": "3-Step Drop Mechanics",
    "steps": [
      {
        "step": 1,
        "label": "Catch",
        "timestamp": 0.0
      },
      {
        "step": 2,
        "label": "First step (6 o'clock)",
        "timestamp": 0.3
      },
      {
        "step": 3,
        "label": "Second step (crossover)",
        "timestamp": 0.5
      },
      {
        "step": 4,
        "label": "Plant and hitch",
        "timestamp": 0.7
      },
      {
        "step": 5,
        "label": "Release",
        "timestamp": 1.0
      }
    ]
  },
  "body": [
    {
      "type": "TextualBody",
      "value": "Good example of 3-step drop fundamentals. Notice how the plant foot is already pointed at the target before the ball is out. Your base is solid and you're throwing on rhythm.",
      "purpose": "commenting",
      "language": "en"
    },
    {
      "type": "TextualBody",
      "value": "positive-example",
      "purpose": "tagging"
    },
    {
      "type": "TextualBody",
      "value": "footwork",
      "purpose": "tagging"
    }
  ],
  "target": {
    "source": "https://videos.example.org/football/drills-2024-03-19.mp4",
    "type": "Video",
    "selector": {
      "type": "FragmentSelector",
      "conformsTo": "http://www.w3.org/TR/media-frags/",
      "value": "t=87.2,89.5"
    }
  }
}
