{
  "@context": [
    "http://www.w3.org/ns/anno.jsonld",
    {
      "ocam": "https://ocam.sport/ns#",
      "domain": "ocam:domain",
      "context": "ocam:context",
      "intent": "ocam:intent",
      "outcome": "ocam:outcome",
      "sport": "ocam:sport",
      "position": "ocam:position",
      "formation": "ocam:formation"
    }
  ],
  "id": "urn:uuid:d4e5f6a7-b8c9-0123-def0-456789012345",
  "type": "Annotation",
  "motivation": "commenting",
  "created": "2024-03-18T15:10:00Z",
  "creator": {
    "id": "https://example.org/coach/james-wilson",
    "type": "Person",
    "name": "James Wilson"
  },
  "sport": "american-football",
  "domain": "tactics",
  "context": {
    "position": "quarterback",
    "situation": "3rd-and-7",
    "formation": "11-personnel-shotgun",
    "coverage": "cover-3"
  },
  "intent": "Find the open receiver in the zone gap",
  "outcome": "Locked onto first read, missed wide-open slot receiver",
  "body": [
    {
      "type": "TextualBody",
      "value": "You identified Cover 3 correctly pre-snap. But watch your eyes here - you stared down Tyler on the out route the whole way. The linebacker jumped it because he read your eyes. Meanwhile, look at Derek in the slot - he settled right in the hole between the hook defender and the safety. That's a 15-yard gain if you come off your first read.",
      "purpose": "commenting",
      "language": "en"
    },
    {
      "type": "TextualBody",
      "value": "progression-read",
      "purpose": "tagging"
    },
    {
      "type": "TextualBody",
      "value": "eye-discipline",
      "purpose": "tagging"
    },
    {
      "type": "TextualBody",
      "value": "zone-coverage",
      "purpose": "tagging"
    }
  ],
  "target": {
    "source": "https://videos.example.org/football/game-2024-03-16.mp4",
    "type": "Video",
    "selector": [
      {
        "type": "FragmentSelector",
        "conformsTo": "http://www.w3.org/TR/media-frags/",
        "value": "t=2156.4,2162.1"
      },
      {
        "type": "SvgSelector",
        "value": "<svg><circle cx=\"180\" cy=\"200\" r=\"20\" stroke=\"blue\" stroke-width=\"3\" fill=\"none\"/><text x=\"150\" y=\"175\" fill=\"blue\" font-size=\"12\">Tyler (1st read)</text><circle cx=\"420\" cy=\"280\" r=\"25\" stroke=\"green\" stroke-width=\"4\" fill=\"none\"/><text x=\"390\" y=\"320\" fill=\"green\" font-size=\"12\">Derek (OPEN)</text><path d=\"M 300,350 L 180,200\" stroke=\"red\" stroke-width=\"2\" stroke-dasharray=\"5,5\"/><text x=\"220\" y=\"270\" fill=\"red\" font-size=\"11\">Your eyes</text></svg>",
        "refinedBy": {
          "type": "FragmentSelector",
          "value": "t=2159.5"
        }
      }
    ]
  }
}
