{
  "@context": [
    "http://www.w3.org/ns/anno.jsonld",
    {
      "ocam": "https://ocam.sport/ns#",
      "domain": "ocam:domain",
      "context": "ocam:context",
      "intent": "ocam:intent",
      "outcome": "ocam:outcome",
      "sport": "ocam:sport",
      "category": "ocam:category"
    }
  ],
  "id": "urn:uuid:a1b2c3d4-e5f6-7890-abcd-ef1234567890",
  "type": "Annotation",
  "motivation": "commenting",
  "created": "2024-03-15T10:30:00Z",
  "creator": {
    "id": "https://example.org/coach/maria-santos",
    "type": "Person",
    "name": "Maria Santos",
    "role": "Head Coach"
  },
  "sport": "tennis",
  "domain": "technique",
  "context": {
    "stroke": "forehand",
    "phase": "takeaway"
  },
  "intent": "Generate topspin with early racket preparation",
  "outcome": "Late takeaway causing rushed contact",
  "body": [
    {
      "type": "TextualBody",
      "value": "Your racket needs to start moving back as soon as you read the ball is coming to your forehand side. Right now you're waiting until the ball bounces before starting your takeaway.",
      "purpose": "commenting",
      "language": "en"
    },
    {
      "type": "TextualBody",
      "value": "late-contact",
      "purpose": "tagging"
    },
    {
      "type": "TextualBody",
      "value": "timing",
      "purpose": "tagging",
      "category": "footwork"
    }
  ],
  "target": {
    "source": "https://videos.example.org/tennis/training-2024-03-15.mp4",
    "type": "Video",
    "duration": 3847.5,
    "hash": {
      "algorithm": "sha256",
      "value": "a3f2b8c1d4e5f6a7b8c9d0e1f2a3b4c5d6e7f8a9b0c1d2e3f4a5b6c7d8e9f0a1"
    },
    "selector": [
      {
        "type": "FragmentSelector",
        "conformsTo": "http://www.w3.org/TR/media-frags/",
        "value": "t=124.5,127.8"
      },
      {
        "type": "SvgSelector",
        "value": "<svg><circle cx=\"340\" cy=\"280\" r=\"25\" stroke=\"red\" stroke-width=\"3\" fill=\"none\"/></svg>",
        "refinedBy": {
          "type": "FragmentSelector",
          "value": "t=125.2"
        }
      }
    ]
  }
}
